{
  "$schema": "./schemas/catalog.schema.json",
  "kind": "nanohype/catalog",
  "version": "1",
  "generated_at": "2026-10-29T08:17:28.000Z",
  "templates": [
    {
      "name": "a2a-agent",
      "displayName": "A2A Agent",
      "description": "Scaffolds an Agent-to-Agent (A2A) protocol peer in TypeScript. A2A is the open protocol for multi-agent interoperability — the agent-level equivalent of MCP (which operates at the tool level). The generated project can expose skills to other agents via an A2A server, discover and invoke capabilities on remote agents via an A2A client, and use an LLM provider for reasoning about which skill to execute. Supports HTTP and WebSocket transports, optional agent discovery with an Agent Card served at /.well-known/agent.json, and a pluggable provider registry for LLM backends that defaults to the Platform's ModelGateway and holds no model credential.",
      "version": "0.1.0",
      "category": "ai-systems",
      "persona": [
        "engineering"
      ],
      "tags": [
        "typescript",
        "agent",
        "a2a",
        "multi-agent",
        "protocol",
        "ai",
        "model-gateway"
      ],
      "kind": "template",
      "path": "templates/a2a-agent"
    },
    {
      "name": "acceptance-criteria",
      "displayName": "Acceptance Criteria",
      "description": "Scaffolds an acceptance criteria framework using Given/When/Then BDD structure. Includes a reusable template for writing criteria, example Gherkin feature files, and an optional definition of done checklist. Provides a consistent format for capturing expected behavior across features and user stories.",
      "version": "0.1.0",
      "category": "qa",
      "persona": [
        "qa"
      ],
      "tags": [
        "testing",
        "qa",
        "bdd",
        "gherkin",
        "acceptance-criteria"
      ],
      "kind": "template",
      "path": "templates/acceptance-criteria"
    },
    {
      "name": "agent-fleet",
      "displayName": "Agent Fleet",
      "description": "Scaffolds the AI-workload composite on top of a Platform tenant. Produces an AgentFleet CR (agents.nanohype.dev/v1alpha1) declaring one or more agents — each a container image bound to a named gateway route — behind a KEDA scaler, plus a ModelGateway CR whose routes resolve a Bedrock model, fix the wire format callers speak, cap request rate and attach a Guardrail. Pairs with k8s-app-tenant — the Platform CR there owns the tenant boundary; this composes the AI pieces inside it.",
      "version": "0.1.0",
      "category": "ai-systems",
      "persona": [
        "engineering"
      ],
      "tags": [
        "kubernetes",
        "bedrock",
        "agents",
        "gateway",
        "keda",
        "nanohype"
      ],
      "kind": "template",
      "path": "templates/agent-fleet"
    },
    {
      "name": "agent-orchestrator",
      "displayName": "Agent Orchestrator",
      "description": "Multi-agent orchestrator that decomposes tasks via an LLM-powered planner agent, routes subtasks to specialized agents based on capability matching, and aggregates results. Agents communicate through a shared context with namespacing and a handoff protocol that creates an audit trail of agent-to-agent transitions. Reasons through the Platform's ModelGateway and holds no model credential.",
      "version": "0.1.0",
      "category": "ai-systems",
      "persona": [
        "engineering"
      ],
      "tags": [
        "typescript",
        "agent",
        "orchestrator",
        "multi-agent",
        "llm",
        "ai",
        "model-gateway"
      ],
      "kind": "template",
      "path": "templates/agent-orchestrator"
    },
    {
      "name": "agentic-loop",
      "displayName": "Agentic Loop",
      "description": "Scaffolds a TypeScript agentic loop that sends messages to an LLM, detects tool-call requests in the response, executes them via a typed tool registry, appends results, and repeats until the model stops calling tools or an iteration limit is reached. Calls the Platform's ModelGateway with tool use and holds no model credential. Includes an optional conversation memory subsystem with token-aware truncation, and an optional eval harness for assertion-based testing against fixture files.",
      "version": "0.1.0",
      "category": "ai-systems",
      "persona": [
        "engineering"
      ],
      "tags": [
        "typescript",
        "agent",
        "llm",
        "tools",
        "agentic",
        "ai",
        "model-gateway"
      ],
      "kind": "template",
      "path": "templates/agentic-loop"
    },
    {
      "name": "api-gateway",
      "displayName": "API Gateway",
      "description": "Scaffolds an API gateway with edge routing, per-route auth and rate limiting, traffic management (canary splits, health checking), and per-upstream circuit breakers. Built on Hono with native fetch proxying, JWT/API key validation via jose, and OpenTelemetry instrumentation.",
      "version": "0.1.0",
      "category": "applications",
      "persona": [
        "engineering"
      ],
      "tags": [
        "typescript",
        "hono",
        "api-gateway",
        "proxy",
        "rate-limit",
        "auth"
      ],
      "kind": "template",
      "path": "templates/api-gateway"
    },
    {
      "name": "battle-cards",
      "displayName": "Competitive Battle Cards",
      "description": "Scaffolds a competitive intelligence package with feature comparison matrices, positioning statements, win/loss analysis templates, and objection handling guides. Gives sales and marketing teams structured ammunition for competitive deals.",
      "version": "0.1.0",
      "category": "sales",
      "persona": [
        "sales"
      ],
      "tags": [
        "competitive",
        "battle-cards",
        "sales",
        "positioning",
        "objections"
      ],
      "kind": "template",
      "path": "templates/battle-cards"
    },
    {
      "name": "brand-guidelines",
      "displayName": "Brand Guidelines",
      "description": "Scaffolds brand guideline documentation covering color palette definitions, typography scale, logo usage rules, and optional voice and tone guidelines. Provides a structured reference for maintaining brand consistency across all touchpoints and teams.",
      "version": "0.1.0",
      "category": "design",
      "persona": [
        "design"
      ],
      "tags": [
        "brand",
        "guidelines",
        "typography",
        "color",
        "voice-tone"
      ],
      "kind": "template",
      "path": "templates/brand-guidelines"
    },
    {
      "name": "brief-campaign-plan",
      "displayName": "Campaign Plan Brief",
      "description": "Scaffolds an agent brief for producing a marketing campaign plan. The rendered brief instructs an agent to define campaign strategy, identify distribution channels, craft messaging pillars, set KPIs and measurement criteria, and produce a structured campaign plan with timeline and budget allocation.",
      "version": "0.1.0",
      "category": "marketing",
      "persona": [
        "marketing"
      ],
      "tags": [
        "brief",
        "campaign",
        "marketing",
        "strategy",
        "kpi"
      ],
      "kind": "brief",
      "path": "templates/brief-campaign-plan"
    },
    {
      "name": "brief-design-review",
      "displayName": "Design Review Brief",
      "description": "Scaffolds an agent brief for conducting a comprehensive design review. The rendered brief instructs an agent to audit visual consistency, design token coverage, accessibility compliance, and component-level coherence against a design system. Produces a structured findings report with prioritized recommendations.",
      "version": "0.1.0",
      "category": "design",
      "persona": [
        "design"
      ],
      "tags": [
        "brief",
        "design-review",
        "accessibility",
        "design-system",
        "audit"
      ],
      "kind": "brief",
      "path": "templates/brief-design-review"
    },
    {
      "name": "brief-onboarding-playbook",
      "displayName": "Onboarding Playbook Brief",
      "description": "Scaffolds an agent brief for producing a customer onboarding playbook. The rendered brief instructs an agent to define onboarding stages, set milestone criteria, create health scoring rubrics, design intervention triggers, and produce a playbook that guides customer success teams from signup through time-to-value.",
      "version": "0.1.0",
      "category": "customer-success",
      "persona": [
        "customer-success"
      ],
      "tags": [
        "brief",
        "onboarding",
        "customer-success",
        "playbook",
        "milestones"
      ],
      "kind": "brief",
      "path": "templates/brief-onboarding-playbook"
    },
    {
      "name": "brief-prd",
      "displayName": "Product Requirements Document Brief",
      "description": "Scaffolds an agent brief for drafting a product requirements document. The rendered brief instructs an agent to analyze a problem space, define functional and non-functional requirements, write user stories, establish success metrics, and produce a complete PRD ready for engineering handoff.",
      "version": "0.1.0",
      "category": "product",
      "persona": [
        "product"
      ],
      "tags": [
        "brief",
        "prd",
        "product",
        "requirements",
        "user-stories"
      ],
      "kind": "brief",
      "path": "templates/brief-prd"
    },
    {
      "name": "brief-proposal",
      "displayName": "Proposal Brief",
      "description": "Scaffolds an agent brief for drafting a client-facing proposal. The rendered brief instructs an agent to analyze client needs, define a solution approach, structure pricing and timeline, articulate differentiators, and produce a polished proposal document ready for client delivery.",
      "version": "0.1.0",
      "category": "sales",
      "persona": [
        "sales"